{
  "schema": "CI_TEST_PERFORMANCE_ASSESSMENT_V2",
  "schema_version": 2,
  "issue_number": 1724,
  "pr_number": 1730,
  "measured_at": "2026-07-25T00:00:00Z",
  "claim": {
    "kind": "none"
  },
  "performance_evidence": {
    "status": "insufficient_samples",
    "runtime_delta": {
      "mode": "comparative",
      "before": {
        "job": "python-test",
        "p50_seconds": 120.0,
        "p95_seconds": 150.0,
        "run_ids": [
          "1000",
          "1001",
          "1002",
          "1003",
          "1004"
        ],
        "run_count": 5,
        "runner_image": "ubuntu-24.04/20260701.1",
        "workers": 4,
        "scheduler": "loadscope",
        "command_manifest_digest": "sha256:aaaaaaaaaaaaaaaaaaaaaaaaaaaaaaaaaaaaaaaaaaaaaaaaaaaaaaaaaaaaaaaa",
        "test_selection_digest": "sha256:bbbbbbbbbbbbbbbbbbbbbbbbbbbbbbbbbbbbbbbbbbbbbbbbbbbbbbbbbbbbbbbb"
      },
      "after": {
        "job": "python-test",
        "p50_seconds": 120.0,
        "p95_seconds": 150.0,
        "run_ids": [
          "1000",
          "1001",
          "1002",
          "1003",
          "1004"
        ],
        "run_count": 5,
        "runner_image": "ubuntu-24.04/20260701.1",
        "workers": 4,
        "scheduler": "loadscope",
        "command_manifest_digest": "sha256:aaaaaaaaaaaaaaaaaaaaaaaaaaaaaaaaaaaaaaaaaaaaaaaaaaaaaaaaaaaaaaaa",
        "test_selection_digest": "sha256:bbbbbbbbbbbbbbbbbbbbbbbbbbbbbbbbbbbbbbbbbbbbbbbbbbbbbbbbbbbbbbbb"
      },
      "delta": {
        "p50_delta_seconds": -5.0,
        "p95_delta_seconds": -3.0,
        "p50_improvement_pct": 4.0,
        "p95_improvement_pct": 2.0
      },
      "outlier_exclusions": [
        {
          "run_id": "1099",
          "reason": "network flake caused a 3x runtime spike",
          "rule_id": "OUTLIER_RULE_NETWORK_FLAKE_V1"
        }
      ]
    }
  },
  "observation": {
    "outcome": "inconclusive"
  },
  "claim_evaluation": {
    "outcome": "not_applicable"
  },
  "functional_evidence": {
    "proof_level": "check_run_only",
    "coverage_bound": false,
    "ci_verdict_summary_ref": {
      "artifact_schema": "ci_verdict_summary_v2",
      "expected_head_sha": "1234567890abcdef1234567890abcdef12345678",
      "overall_status": "merge_ready",
      "selected_checks": [
        {
          "check_run_id": 1001,
          "status": "completed",
          "conclusion": "success",
          "head_sha_match": true,
          "classification": "required"
        }
      ]
    }
  },
  "declared_impact": "No performance-relevant changes; schema/docs addition only.",
  "risk_acknowledgement": {
    "reference": {
      "source_kind": "issue_comment",
      "source_id": "issuecomment-5077131957"
    },
    "verification_status": "unverified"
  }
}
